Topic,Words
1,"차장, 북한, 통일, 일본, 대통령, 정상, 미국, 캠프, 총리, 독트린"
2,"해리스, 부통령, 주택, 정책, 바이든, 계획, 경제, 혜택, 캠프, 민주당"
3,"차장, 통일, 캠프, 독트린, 선언, 대해, 일본, 구상, 지지, 북한"
4,"북한, 대선, 차장, 남북, 대화, 협상, 통일, 제안, 독트린, 호응"
5,"선수, 파리올림픽, 대통령, 금메달, 야구, 선수단, 격려, 올림픽, 기념, 국민"
6,"후보, 부통령, 대해, 민주당, 정도, 대통령, 부정, 동의, 선택, 반면"
7,"대북, 차장, 위반, 입장, 정부, 항공, 통일, 북한, 자유, 단체"
8,"선수, 대통령, 선수단, 금메달, 올림픽, 축제, 야구, 파리, 파리올림픽, 행사"
9,"대통령, 선수, 파리, 출연, 올림픽, 윤석열, 선수단, 격려, 금메달, 안보"
10,"대통령, 선수, 파리올림픽, 금메달, 야구, 선수단, 올림픽, 등장, 축제, 대통령실"
11,"파리올림픽, 금메달, 축제, 선수, 파리, 올림픽, 재판매, 인사, 기념, 개최"
12,"선수, 대통령, 파리올림픽, 정말, 축제, 파리, 선수단, 격려, 참석, 공원"
13,"선수, 대통령, 선수단, 파리올림픽, 올림픽, 격려, 금메달, 파리, 야구, 기념"
14,"축제, 파리, 올림픽, 재판매, 질문, 기념, 개최, 여의도, 금지, 윤석열"
15,"축제, 파리, 올림픽, 재판매, 기념, 개최, 여의도, 금지, 윤석열, 행사"
16,"축제, 파리, 올림픽, 재판매, 질문, 기념, 개최, 여의도, 금지, 윤석열"
17,"파리, 올림픽, 금메달, 축제, 선수, 재판매, 인사, 기념, 개최, 여의도"
18,"축제, 파리, 올림픽, 재판매, 인사, 기념, 개최, 여의도, 금지, 윤석열"
19,"파리, 올림픽, 축제, 선수, 재판매, 인사, 기념, 개최, 여의도, 금지"
20,"올림픽, 격려, 축제, 선수, 공원, 파리, 기념, 여의도, 윤석열, 행사"
21,"선수, 대통령, 올림픽, 금메달, 정말, 야구, 종목, 파리, 국민, 선수단"
22,"축제, 공원, 파리, 올림픽, 기념, 여의도, 윤석열, 행사, 대통령, 뉴스"
23,"답변, 축제, 공원, 인터뷰, 파리, 올림픽, 질문, 기념, 여의도, 윤석열"
24,"답변, 축제, 공원, 인터뷰, 파리, 올림픽, 질문, 기념, 여의도, 윤석열"
25,"올림픽, 격려, 축제, 선수, 공원, 파리, 기념, 여의도, 윤석열, 행사"
26,"파리올림픽, 금메달, 축제, 선수, 공원, 파리, 인사, 기념, 개인, 여의도"
27,"축제, 공원, 파리, 올림픽, 인사, 기념, 여의도, 윤석열, 참석, 행사"
28,"파리올림픽, 선수단, 격려, 축제, 공원, 파리, 기념, 여의도, 윤석열, 참석"
29,"파리올림픽, 금메달, 축제, 공원, 선수, 파리, 단체, 인사, 기념, 여의도"
30,"파리올림픽, 축제, 선수, 공원, 파리, 인사, 기념, 여의도, 윤석열, 참석"
31,"파리올림픽, 축제, 공원, 파리, 기념, 여의도, 윤석열, 참석, 행사, 대통령"
32,"파리올림픽, 축제, 공원, 파리, 기념, 여의도, 윤석열, 참석, 행사, 대통령"
33,"파리올림픽, 무대, 축제, 공원, 파리, 인사, 기념, 여의도, 윤석열, 참석"
34,"파리올림픽, 금메달, 축제, 공원, 선수, 파리, 인사, 기념, 개인, 여의도"
35,"선수, 올림픽, 금메달, 대통령, 야구, 선수단, 파리, 행사, 격려, 종목"
36,"선수, 대통령, 올림픽, 선수단, 금메달, 야구, 축제, 파리올림픽, 기념, 공원"
37,"해리스, 부통령, 주택, 정책, 바이든, 계획, 경제, 혜택, 캠프, 민주당"
38,"후보, 부통령, 대해, 민주당, 정도, 대통령, 부정, 동의, 선택, 반면"
39,"후보자, 신고, 아파트, 위원장, 명의, 원장, 부부, 자문, 독립, 법인"
40,"의원, 국민, 민주당, 소속, 촉구, 제출, 추진, 사과, 제보, 대한"
41,"국내, 소비자, 테크, 결제, 디지털, 의원, 수수료, 글로벌, 구글, 애플"
42,"배정, 위원, 정원, 정위, 교육부, 의대, 회의, 국회, 민주당, 의원"
43,"정위, 회의, 자료, 파기, 의원, 교육부, 청문회, 작성, 배정, 내용"
44,"후보, 네트워크, 민주당, 의원, 대표, 전국, 인사, 기자회견, 경남, 선거"
45,"의원, 구성, 경남, 조직, 대표, 정치, 인사, 민주당, 최근, 지사"
46,"민주당, 국민, 대표, 의혹, 대변인, 수사, 제보, 절차, 제안, 의견"
47,"의대, 배정, 증원, 의원, 교육, 정원, 위원회, 민주당, 의사, 점검"
48,"후보자, 신고, 국방부, 회관, 장관, 명의, 서울, 대통령, 마련, 사망"
49,"후보자, 명의, 자산, 신고, 자녀, 대통령, 대부분, 사실, 장관, 국방부"
50,"달러, 비트코인, 재의, 국회, 행사, 하락, 야당, 봉투, 윤석열, 대통령"
51,"검찰, 대통령, 수사, 의원, 채용, 기자회견, 민주당, 출신, 스타, 사건"
52,"출범, 조직, 후보, 네트워크, 전국, 기자회견, 지지, 인사, 민주당, 정권"
53,"의원, 민주당, 구성, 지사, 조직, 대표, 소속, 목표, 지난, 과정"
54,"인재, 갤럭시, 대표, 삼성, 청년, 발굴, 수도권, 확장, 국민, 반도체"
55,"의원, 국민, 발언, 사과, 위원, 민주당, 책임, 윤석열, 국회, 최고"
56,"의료, 확충, 필수, 지역, 교육, 수가, 의대, 의사, 재정, 증원"
57,"의장, 부총리, 재정, 민생, 상황, 국회, 경제, 우려, 장관, 라며"
58,"인재, 의원, 갤럭시, 국민, 삼성, 청년, 출신, 수도권, 확장, 사장"
59,"증원, 제출, 의대, 대학, 정원, 계획, 예산, 수도권, 의원, 실습"
60,"북한, 민주당, 대통령, 주민, 축사, 대변인, 라며, 발언, 비판, 윤석열"
61,"이임, 이종호, 정보통신부, 세종, 과학기술, 청사, 장관, 오후, 정부, 분담"
62,"이임, 이종호, 정보통신부, 세종, 과학기술, 청사, 장관, 오후, 정부, 분담"
63,"청사, 이임, 이종호, 정보통신부, 세종, 과학기술, 장관, 오후, 정부, 북한"
64,"이임, 이종호, 정보통신부, 세종, 과학기술, 청사, 장관, 오후, 정부, 분담"
65,"청사, 이임, 이종호, 정보통신부, 세종, 과학기술, 장관, 오후, 정부, 북한"
66,"실장, 과학기술, 우주, 정책, 전파, 항공, 이종호, 차관, 중앙, 혁신"
67,"배터리, 등록, 전기차, 조사, 공개, 정보, 상품, 자동차, 차량, 소비자"
68,"대변인, 법안, 민생, 대통령, 재의, 국민, 윤석열, 여야, 민주당, 경제"
69,"의료, 대구, 간담, 의장, 위원, 최고, 의사, 국민, 정책, 사회"
70,"후보자, 신고, 인권, 원장, 신임, 증권, 아파트, 자문, 독립, 법인"
71,"후보자, 신고, 국방부, 명의, 장관, 자녀, 부장, 본부, 안보, 아파트"
72,"의대, 의원, 교육부, 정위, 장관, 배정, 집단, 증원, 청문회, 파기"
73,"세종, 정통부, 취임식, 상임, 재판매, 기자, 대화, 정보통신부, 금지, 과학기술"
74,"실장, 과학기술, 우주, 정책, 전파, 항공, 차관, 상임, 중앙, 혁신"
75,"세종, 취임식, 취임, 상임, 재판매, 정보통신부, 금지, 과학기술, 청사, 장관"
76,"세종, 취임식, 취임, 상임, 재판매, 정보통신부, 금지, 과학기술, 청사, 장관"
77,"세종, 취임식, 취임, 상임, 재판매, 정보통신부, 금지, 과학기술, 청사, 장관"
78,"세종, 취임식, 취임, 상임, 재판매, 정보통신부, 금지, 과학기술, 청사, 장관"
79,"세종, 취임식, 취임, 상임, 재판매, 정보통신부, 금지, 과학기술, 청사, 장관"
80,"세종, 정통부, 취임식, 상임, 재판매, 기자, 대화, 정보통신부, 금지, 과학기술"
81,"세종, 정통부, 취임식, 상임, 재판매, 기자, 대화, 정보통신부, 금지, 과학기술"
82,"이임, 이종호, 재판매, 정보통신부, 세종, 금지, 과학기술, 청사, 장관, 오후"
83,"실장, 과학기술, 우주, 정책, 전파, 항공, 이종호, 차관, 중앙, 혁신"
84,"이임, 이종호, 재판매, 정보통신부, 세종, 금지, 과학기술, 청사, 장관, 오후"
85,"이임, 이종호, 재판매, 정보통신부, 세종, 금지, 과학기술, 청사, 장관, 오후"
86,"청사, 이임, 이종호, 재판매, 정보통신부, 세종, 금지, 과학기술, 장관, 오후"
87,"정비, 설립, 구역, 지정, 절차, 사업, 추진, 주민, 지원, 계획"
88,"홍보, 시장, 사랑, 능력, 출신, 도시, 최선, 프로그램, 더욱, 자리"
89,"주민, 지구, 변경, 기존, 해결, 설치, 시장, 방법, 관리, 문제"
90,"변경, 기존, 관리, 시장, 설립, 전달, 인근, 주민, 수요, 해결"
91,"독립, 축제, 공연, 공원, 대한민국, 프로그램, 의미, 더욱, 방문, 때문"
92,"등록, 신고, 변경, 기간, 사항, 기관, 운영, 사망, 장치, 대한"
93,"서울, 촬영, 기념, 장관, 국가, 오후, 범위, 법안, 법원, 법인"
94,"서울, 장관, 국가, 오후, 보건복지부, 보건, 병원, 별로, 별도, 버스"
95,"서울, 장관, 국가, 오후, 보건복지부, 보건, 병원, 별로, 별도, 버스"
96,"한국, 장관, 경제, 협력, 외교, 능력, 가정, 주년, 추가, 도움"
97,"사업, 관광, 조성, 개발, 경제, 경남, 구역, 추진, 방문, 자유"
98,"의원, 혐의, 건설, 경찰, 요구, 처벌, 광주, 수사, 특정, 대가"
99,"임명, 확정, 질의, 언론, 대통령실, 광복회, 공개, 해당, 부정, 집행"
100,"지정, 신규, 마련, 지원, 사항, 발전, 경제, 논의, 원장, 지속"
